{
  "schemaVersion": 1,
  "locales": [
    "pl",
    "en"
  ],
  "providers": [
    {
      "id": "enea",
      "utility": "power",
      "order": {
        "frontend": 0,
        "rust": 5,
        "androidSingle": 2,
        "addon": 9
      },
      "defaultNotify": true,
      "labels": {
        "frontend": {
          "name": {
            "pl": "Enea",
            "en": "Enea"
          },
          "shortName": {
            "pl": "Enea",
            "en": "Enea"
          }
        },
        "rust": {
          "name": {
            "pl": "Enea"
          }
        },
        "android": {
          "shortName": {
            "pl": "Enea",
            "en": "Enea"
          },
          "legacyWidget": {
            "resource": "widget_label_enea",
            "name": {
              "pl": "Enea",
              "en": "Enea"
            }
          }
        }
      },
      "aliases": [],
      "bindings": {
        "rust": {
          "enumVariant": "Enea",
          "constructor": "enea::EneaProvider"
        },
        "android": {
          "legacyComponentClass": "EneaWidgetProvider",
          "legacyLabelResource": "widget_label_enea"
        }
      },
      "capabilities": {
        "webviewOnly": false,
        "addonAllowed": true
      },
      "icsUtility": "power",
      "android": {
        "singleWidget": true,
        "searchAliases": [
          "ENEA",
          "Polska"
        ],
        "location": "Polska",
        "aggregateUtility": "power",
        "aggregateOrder": 3
      },
      "card": {
        "name": "Enea",
        "icon": "⚡",
        "color": "#fb8c00"
      }
    },
    {
      "id": "energa",
      "utility": "power",
      "order": {
        "frontend": 1,
        "rust": 4,
        "androidSingle": 3,
        "addon": 8
      },
      "defaultNotify": true,
      "labels": {
        "frontend": {
          "name": {
            "pl": "Energa",
            "en": "Energa"
          },
          "shortName": {
            "pl": "Energa",
            "en": "Energa"
          }
        },
        "rust": {
          "name": {
            "pl": "Energa"
          }
        },
        "android": {
          "shortName": {
            "pl": "Energa",
            "en": "Energa"
          },
          "legacyWidget": {
            "resource": "widget_label_energa",
            "name": {
              "pl": "Energa",
              "en": "Energa"
            }
          }
        }
      },
      "aliases": [],
      "bindings": {
        "rust": {
          "enumVariant": "Energa",
          "constructor": "energa::EnergaProvider"
        },
        "android": {
          "legacyComponentClass": "EnergaWidgetProvider",
          "legacyLabelResource": "widget_label_energa"
        }
      },
      "capabilities": {
        "webviewOnly": false,
        "addonAllowed": true
      },
      "icsUtility": "power",
      "android": {
        "singleWidget": true,
        "searchAliases": [
          "ENERGA",
          "Polska"
        ],
        "location": "Polska",
        "aggregateUtility": "power",
        "aggregateOrder": 2
      },
      "card": {
        "name": "Energa",
        "icon": "⚡",
        "color": "#ffa726"
      }
    },
    {
      "id": "pge",
      "utility": "power",
      "order": {
        "frontend": 2,
        "rust": 10,
        "androidSingle": 4,
        "addon": 15
      },
      "defaultNotify": true,
      "labels": {
        "frontend": {
          "name": {
            "pl": "PGE",
            "en": "PGE"
          },
          "shortName": {
            "pl": "PGE",
            "en": "PGE"
          }
        },
        "rust": {
          "name": {
            "pl": "PGE"
          }
        },
        "android": {
          "shortName": {
            "pl": "PGE",
            "en": "PGE"
          },
          "legacyWidget": {
            "resource": "widget_label_pge",
            "name": {
              "pl": "PGE",
              "en": "PGE"
            }
          }
        }
      },
      "aliases": [],
      "bindings": {
        "rust": {
          "enumVariant": "Pge",
          "constructor": "pge::PgeProvider"
        },
        "android": {
          "legacyComponentClass": "PgeWidgetProvider",
          "legacyLabelResource": "widget_label_pge"
        }
      },
      "capabilities": {
        "webviewOnly": false,
        "addonAllowed": true
      },
      "icsUtility": "power",
      "android": {
        "singleWidget": true,
        "searchAliases": [
          "PGE",
          "Polska"
        ],
        "location": "Polska",
        "aggregateUtility": "power",
        "aggregateOrder": 4
      },
      "card": {
        "name": "PGE",
        "icon": "⚡",
        "color": "#ffb74d"
      }
    },
    {
      "id": "stoen",
      "utility": "power",
      "order": {
        "frontend": 3,
        "rust": 13,
        "androidSingle": 1,
        "addon": 17
      },
      "defaultNotify": true,
      "labels": {
        "frontend": {
          "name": {
            "pl": "Stoen",
            "en": "Stoen"
          },
          "shortName": {
            "pl": "Stoen",
            "en": "Stoen"
          }
        },
        "rust": {
          "name": {
            "pl": "Stoen"
          }
        },
        "android": {
          "shortName": {
            "pl": "Stoen",
            "en": "Stoen"
          },
          "legacyWidget": {
            "resource": "widget_label_stoen",
            "name": {
              "pl": "Stoen",
              "en": "Stoen"
            }
          }
        }
      },
      "aliases": [],
      "bindings": {
        "rust": {
          "enumVariant": "Stoen",
          "constructor": "stoen::StoenProvider"
        },
        "android": {
          "legacyComponentClass": "StoenWidgetProvider",
          "legacyLabelResource": "widget_label_stoen"
        }
      },
      "capabilities": {
        "webviewOnly": false,
        "addonAllowed": true
      },
      "icsUtility": "power",
      "android": {
        "singleWidget": true,
        "searchAliases": [
          "E.ON",
          "Warszawa"
        ],
        "location": "Warszawa",
        "aggregateUtility": "power",
        "aggregateOrder": 1
      },
      "card": {
        "name": "Stoen",
        "icon": "⚡",
        "color": "#f57c00"
      },
      "frontend": {
        "regionMatcher": "warszawa"
      }
    },
    {
      "id": "tauron",
      "utility": "power",
      "order": {
        "frontend": 4,
        "rust": 0,
        "androidSingle": 0,
        "addon": 0
      },
      "defaultNotify": true,
      "labels": {
        "frontend": {
          "name": {
            "pl": "Tauron",
            "en": "Tauron"
          },
          "shortName": {
            "pl": "Tauron",
            "en": "Tauron"
          }
        },
        "rust": {
          "name": {
            "pl": "Tauron"
          }
        },
        "android": {
          "shortName": {
            "pl": "Tauron",
            "en": "Tauron"
          },
          "legacyWidget": {
            "resource": "widget_label_tauron",
            "name": {
              "pl": "Tauron",
              "en": "Tauron"
            }
          }
        }
      },
      "aliases": [],
      "bindings": {
        "rust": {
          "enumVariant": "Tauron",
          "constructor": "tauron::TauronProvider"
        },
        "android": {
          "legacyComponentClass": "TauronWidgetProvider",
          "legacyLabelResource": "widget_label_tauron"
        }
      },
      "capabilities": {
        "webviewOnly": false,
        "addonAllowed": true
      },
      "icsUtility": "power",
      "android": {
        "singleWidget": true,
        "searchAliases": [
          "TAURON",
          "Polska"
        ],
        "location": "Polska",
        "aggregateUtility": "power",
        "aggregateOrder": 0
      },
      "card": {
        "name": "Tauron",
        "icon": "⚡",
        "color": "#ff9800"
      }
    },
    {
      "id": "psg",
      "utility": "gas",
      "order": {
        "frontend": 5,
        "rust": 14,
        "androidSingle": 62,
        "addon": null
      },
      "defaultNotify": true,
      "labels": {
        "frontend": {
          "name": {
            "pl": "PSG",
            "en": "PSG"
          },
          "shortName": {
            "pl": "PSG",
            "en": "PSG"
          }
        },
        "rust": {
          "name": {
            "pl": "PSG"
          }
        },
        "android": {
          "shortName": {
            "pl": "PSG",
            "en": "PSG"
          },
          "legacyWidget": {
            "resource": "widget_label_psg",
            "name": {
              "pl": "PSG",
              "en": "PSG"
            }
          }
        }
      },
      "aliases": [],
      "bindings": {
        "rust": {
          "enumVariant": "Psg",
          "constructor": "psg::PsgProvider"
        },
        "android": {
          "legacyComponentClass": "PsgWidgetProvider",
          "legacyLabelResource": "widget_label_psg"
        }
      },
      "capabilities": {
        "webviewOnly": true,
        "addonAllowed": false
      },
      "icsUtility": "gas",
      "android": {
        "singleWidget": true,
        "searchAliases": [
          "Polska Spółka Gazownictwa",
          "Polska"
        ],
        "location": "Polska",
        "aggregateUtility": "gas",
        "aggregateOrder": 0
      },
      "card": {
        "name": "PSG Gaz",
        "icon": "💨",
        "color": "#4caf50"
      }
    },
    {
      "id": "eco_sa",
      "utility": "heating",
      "order": {
        "frontend": 6,
        "rust": 7,
        "androidSingle": 6,
        "addon": 12
      },
      "defaultNotify": true,
      "labels": {
        "frontend": {
          "name": {
            "pl": "ECO SA",
            "en": "ECO SA"
          },
          "shortName": {
            "pl": "ECO SA",
            "en": "ECO SA"